{
  "version": 1,
  "name": "calibrator-flats",
  "description": "Flat-field capture against a cover calibrator: close the cover, light the panel, then per filter find the exposure that hits the target ADU (halving the panel brightness whenever the search ends pinned over the target) and capture the requested flats; the cover ends in the state it started in — reopened only if it began open. On a filterless (one-shot color) rig, leave filter_wheel_id at its '' default: set_filter is skipped and filters entries are plain capture groups. The document port of the calibrator-flats Rust orchestrator (docs/services/calibrator-flats.md), whose BDD suite is the behavioral oracle.",
  "parameters": {
    "camera_id": { "type": "string", "required": true },
    "filter_wheel_id": { "type": "string", "default": "" },
    "calibrator_id": { "type": "string", "required": true },
    "filters": { "type": "array", "required": true },
    "target_adu_fraction": { "type": "number", "default": 0.5 },
    "tolerance": { "type": "number", "default": 0.05 },
    "max_iterations": { "type": "integer", "default": 10 },
    "initial_duration": { "type": "duration", "default": "1s" }
  },
  "estimated_duration": "30m",
  "max_duration": "4h",
  "triggers": [],
  "root": {
    "sequence": [
      {
        "id": "camera-info",
        "tool": "get_camera_info",
        "args": { "camera_id": { "$expr": "params.camera_id" } }
      },
      {
        "set": {
          "session.target_adu": "result.max_adu * params.target_adu_fraction",
          "session.exp_min": "seconds(result.exposure_min)",
          "session.exp_max": "seconds(result.exposure_max)",
          "session.filter_index": "has(session.filter_index) ? session.filter_index : 0",
          "session.report.total_frames": "has(session.report.total_frames) ? session.report.total_frames : 0"
        }
      },
      {
        "id": "target-adu-guard",
        "if": "session.target_adu <= 0",
        "then": [
          { "fail": { "message": "'target_adu is not positive (max_adu * target_adu_fraction) — check get_camera_info and target_adu_fraction'" } }
        ]
      },
      {
        "id": "initial-cover",
        "tool": "get_cover_state",
        "args": { "calibrator_id": { "$expr": "params.calibrator_id" } }
      },
      {
        "set": {
          "session.initial_cover_state": "has(session.initial_cover_state) ? session.initial_cover_state : result.cover_state"
        }
      },
      {
        "try": [
          {
            "tool": "close_cover",
            "args": { "calibrator_id": { "$expr": "params.calibrator_id" } }
          },
          { "tool": "start_cooldown", "args": {} },
          {
            "tool": "calibrator_on",
            "args": { "calibrator_id": { "$expr": "params.calibrator_id" } }
          },
          {
            "set": {
              "session.brightness": "has(session.brightness) ? session.brightness : result.brightness"
            }
          },
          {
            "id": "filter-plan",
            "repeat": {
              "while": "has(params.filters[session.filter_index])",
              "max_iterations": 64
            },
            "body": [
              {
                "if": "params.filter_wheel_id != ''",
                "then": [
                  {
                    "tool": "set_filter",
                    "args": {
                      "filter_wheel_id": { "$expr": "params.filter_wheel_id" },
                      "filter_name": { "$expr": "params.filters[session.filter_index].name" }
                    }
                  }
                ]
              },
              {
                "set": {
                  "session.duration": "seconds(params.initial_duration)",
                  "session.group_converged": "false",
                  "session.ladder_done": "false"
                }
              },
              {
                "id": "brightness-ladder",
                "repeat": {
                  "until": "session.group_converged == true || session.ladder_done == true",
                  "max_iterations": 32
                },
                "body": [
                  {
                    "id": "find-exposure",
                    "repeat": {
                      "until": "abs(session.median_adu - session.target_adu) / session.target_adu <= params.tolerance",
                      "max_iterations": { "$expr": "params.max_iterations" }
                    },
                    "body": [
                      {
                        "tool": "capture",
                        "args": {
                          "camera_id": { "$expr": "params.camera_id" },
                          "duration": { "$expr": "humantime(session.duration)" }
                        }
                      },
                      {
                        "tool": "compute_image_stats",
                        "args": { "document_id": { "$expr": "result.document_id" } }
                      },
                      {
                        "set": { "session.median_adu": "result.median_adu" }
                      },
                      {
                        "if": "abs(session.median_adu - session.target_adu) / session.target_adu > params.tolerance",
                        "then": [
                          {
                            "set": {
                              "session.duration": "clamp(session.median_adu == 0 ? session.duration * 2 : session.duration * (session.target_adu / session.median_adu), session.exp_min, session.exp_max)"
                            }
                          }
                        ]
                      }
                    ]
                  },
                  {
                    "set": { "session.group_converged": "result.converged" }
                  },
                  {
                    "if": "session.group_converged == false && session.median_adu > session.target_adu && floor(session.brightness / 2) >= 1",
                    "then": [
                      {
                        "set": { "session.brightness": "floor(session.brightness / 2)" }
                      },
                      {
                        "tool": "calibrator_on",
                        "args": {
                          "calibrator_id": { "$expr": "params.calibrator_id" },
                          "brightness": { "$expr": "session.brightness" }
                        }
                      }
                    ],
                    "else": [
                      {
                        "set": { "session.ladder_done": "true" }
                      }
                    ]
                  }
                ]
              },
              {
                "if": "session.group_converged == false",
                "then": [
                  {
                    "log": {
                      "level": "info",
                      "message": "exposure did not converge, using best duration",
                      "values": {
                        "filter": "params.filters[session.filter_index].name",
                        "duration": "humantime(session.duration)",
                        "median_adu": "session.median_adu"
                      }
                    }
                  }
                ]
              },
              {
                "id": "capture-flats",
                "repeat": { "count": { "$expr": "params.filters[session.filter_index].count" } },
                "body": [
                  {
                    "tool": "capture",
                    "args": {
                      "camera_id": { "$expr": "params.camera_id" },
                      "duration": { "$expr": "humantime(session.duration)" }
                    }
                  }
                ]
              },
              {
                "set": {
                  "session.report.total_frames": "session.report.total_frames + params.filters[session.filter_index].count",
                  "session.filter_index": "session.filter_index + 1"
                }
              }
            ]
          },
          {
            "if": "result.converged == false",
            "then": [
              { "fail": { "message": "'the filter plan exceeds the 64-filter loop budget'" } }
            ]
          }
        ],
        "finally": [
          {
            "tool": "calibrator_off",
            "args": { "calibrator_id": { "$expr": "params.calibrator_id" } }
          },
          {
            "if": "session.initial_cover_state == 'Open'",
            "then": [
              {
                "tool": "open_cover",
                "args": { "calibrator_id": { "$expr": "params.calibrator_id" } }
              }
            ]
          },
          { "tool": "start_warmup", "args": {} }
        ]
      }
    ]
  }
}
